Position,Const,Created,Modified,Description,Name,Known For,Birth Date
42,nm0001426,2012-10-05,2012-10-05,"He is an English actor who has won an Oscar, BAFTA, Golden Globe and Screen Actors Guild awards in his career. He is known for starring as Mohandas Gandhi in the film Gandhi in 1982, for which he won the Academy Award for Best Actor. He is also known for his performances in the films Schindler's List (1993), Sexy Beast (2000), and Hugo (2011).","Ben Kingsley","Sexy Beast","31. Dezember 1943"
43,nm0000146,2012-10-05,2012-10-05,"is an English theatre and film actor. A noted Shakespeare interpreter, he first achieved success onstage in the Royal National Theatre. Since then, he has portrayed characters such as Nazi war criminal Amon Goeth in Schindler's List, Count Almásy in The English Patient, and Charles Van Doren in Quiz Show. He also starred in The Constant Gardener, Strange Days, Red Dragon, Onegin, and The End of the Affair, among others. He is also well known for playing Lord Voldemort in the Harry Potter film series. In 2011, Fiennes made his directorial debut with his film adaptation of Shakespeare's tragedy Coriolanus, in which he also played the titular character. Fiennes won a Tony Award for playing Hamlet on Broadway and has been nominated twice for the Academy Award.","Ralph Fiennes","The Constant Gardener","22. Dezember 1962"
44,nm0000620,2012-10-05,2012-10-05,"During the 1980s, Rourke starred in Diner, Rumble Fish, and the erotic drama 9½ Weeks, and received critical praise for his work in Barfly and Angel Heart. In 1991, Rourke, who had trained as a boxer in his early years, left acting and became a professional boxer for a period. He had supporting roles in several later films, including The Rainmaker, Buffalo '66, The Pledge, Get Carter, Spun, Once Upon a Time in Mexico and Man on Fire.","Mickey Rourke","Sin City","16. September 1952"
45,nm0000140,2012-10-05,2012-10-05,"He is an American actor and producer, primarily in movies and television. He has won three Golden Globes and two Academy Awards; as producer of 1975's Best Picture, One Flew Over the Cuckoo's Nest, and as Best Actor in 1987 for his role in Wall Street. Douglas received the AFI Life Achievement Award in 2009.","Michael Douglas","Behind the Candelabra","25. September 1944"
46,nm0000640,2012-10-05,2012-10-05,"He is an American film actor best known for his performance as President Josiah Bartlet in the television series The West Wing (1999–2006). He achieved fame with roles in the films Badlands (1973) and Apocalypse Now (1979), and made notable appearances in Wall Street (1987), The Departed (2006), The Amazing Spider-Man (2012).He is considered one of the best actors never to be nominated for an Academy Award despite his acclaimed performances.","Martin Sheen","The Departed","3. August 1940"
47,nm0000560,2012-10-05,2012-10-05,"His career has spanned over five decades, peaking in the 1990s, when his commercial success made him one of the better known stars of that decade. His films include 48 Hrs. (1982), Another 48 Hrs. (1990), Cape Fear (1991), Afterglow (1997), Affliction (1997), The Thin Red Line (1998), The Good Thief (2003), and Warrior (2011). He has been nominated for three Academy Awards, twice for Best Actor and once for Best Supporting Actor.","Nick Nolte","Warrior","8. Februar 1941"
48,nm0000313,2012-10-05,2012-10-05,"is an American actor, musician, producer, photographer, cartoonist, storyteller, and occasional vintner. He comes from a well-known acting family and began his first televised acting in 1958 as child with his father, Lloyd Bridges, and brother Beau on television's Sea Hunt. Some of his best-known major motion films include: Tron (and its sequel), Fearless, Iron Man, The Contender, Starman, The Fabulous Baker Boys, Jagged Edge, Against All Odds, The Fisher King, Thunderbolt and Lightfoot, Seabiscuit, Arlington Road, and The Big Lebowski. He won the Academy Award for Best Actor for his role as Otis Bad Blake in the 2009 film Crazy Heart and earned his sixth Academy Award nomination for his portrayal of Rooster Cogburn in 2010's True Grit.","Jeff Bridges","The Big Lebowski","4. Dezember 1949"
49,nm0000438,2012-10-05,2012-10-05,"He is an American actor, writer, and director, known for his performances in Pollock, Appaloosa, The Rock, The Abyss, A Beautiful Mind, A History of Violence, Enemy at the Gates, The Right Stuff, Gone, Baby, Gone, Jackknife, Empire Falls and Game Change. Harris has also narrated commercials for The Home Depot and other companies. He is a three-time nominee of the Academy Award for Best Supporting Actor for his performances in Apollo 13, The Truman Show and The Hours, along with an Academy Award for Best Actor nomination for the title role in Pollock.","Ed Harris","Appaloosa","28. November 1950"
50,nm0000242,2012-10-05,2012-10-05,"He is an American actor, film and television producer, and former rapper. He was known as Marky Mark in his earlier years, and became famous for his 1991 debut as frontman with the band Marky Mark and the Funky Bunch. He was named No. 1 on VH1's 40 Hottest Hotties of the 90's. Wahlberg is well known for his roles in films such as Fear (1996), Boogie Nights (1997), Three Kings (1999), The Perfect Storm (2000), Planet of the Apes (2001), Rock Star (2001), The Italian Job (2003), I Heart Huckabees (2004), Four Brothers (2005), The Departed (2006), Invincible (2006), Shooter (2007), Max Payne (2008), The Fighter (2010), Date Night (2010), and Ted (2012). He has also served as the executive producer of the TV series Entourage, Boardwalk Empire and How to Make It in America.","Mark Wahlberg","The Fighter","5. Juni 1971"
